{
  "$schema": "http://json-schema.org/draft-07/schema#",
  "type": "object",
  "properties": {
    "$schema": {
      "type": "string",
      "const": "https://www.tankpkg.dev/schemas/v1/skills.json"
    },
    "name": {
      "type": "string",
      "minLength": 1,
      "maxLength": 214,
      "pattern": "^@[a-z0-9-]+\\/[a-z0-9][a-z0-9-]*$"
    },
    "version": {
      "type": "string",
      "pattern": "^\\d+\\.\\d+\\.\\d+(-[a-zA-Z0-9.-]+)?(\\+[a-zA-Z0-9.-]+)?$"
    },
    "description": {
      "type": "string",
      "maxLength": 500
    },
    "skills": {
      "type": "object",
      "propertyNames": {
        "type": "string"
      },
      "additionalProperties": {
        "type": "string"
      }
    },
    "permissions": {
      "type": "object",
      "properties": {
        "network": {
          "type": "object",
          "properties": {
            "outbound": {
              "type": "array",
              "items": {
                "type": "string"
              }
            }
          },
          "additionalProperties": false
        },
        "filesystem": {
          "type": "object",
          "properties": {
            "read": {
              "type": "array",
              "items": {
                "type": "string"
              }
            },
            "write": {
              "type": "array",
              "items": {
                "type": "string"
              }
            }
          },
          "additionalProperties": false
        },
        "subprocess": {
          "type": "boolean"
        }
      },
      "additionalProperties": false
    },
    "repository": {
      "type": "string",
      "format": "uri"
    },
    "visibility": {
      "type": "string",
      "enum": [
        "public",
        "private"
      ]
    },
    "audit": {
      "type": "object",
      "properties": {
        "min_score": {
          "type": "number",
          "minimum": 0,
          "maximum": 10
        }
      },
      "required": [
        "min_score"
      ],
      "additionalProperties": false
    }
  },
  "required": [
    "name",
    "version"
  ],
  "additionalProperties": false,
  "$id": "https://www.tankpkg.dev/schemas/v1/skills.json"
}
